{
  "schema_version": "packaging-ocr-observations.v1",
  "engine": "macos_vision",
  "engine_version": "replace_with_observed_version",
  "preflight_adapter_path": "scripts/run_ocr_preflight.py",
  "preflight_adapter_sha256": "0000000000000000000000000000000000000000000000000000000000000000",
  "engine_adapter_path": "scripts/macos_vision_ocr.swift",
  "engine_adapter_sha256": "0000000000000000000000000000000000000000000000000000000000000000",
  "language_set": ["zh-Hans", "en-US"],
  "uses_language_correction": false,
  "created_at": "replace_with_iso8601",
  "source_records": [
    {
      "source_id": "SRC_001",
      "file_path": "project/relative/source.png",
      "file_sha256": "0000000000000000000000000000000000000000000000000000000000000000",
      "pixel_dimensions": {"width": 1, "height": 1},
      "whole_product_ocr_passes": [
        {
          "pass_id": "SRC_001_FULL_01",
          "scope": "whole_product",
          "engine_id": "macos_vision",
          "engine_version": "replace_with_observed_version",
          "preflight_adapter_path": "scripts/run_ocr_preflight.py",
          "preflight_adapter_sha256": "0000000000000000000000000000000000000000000000000000000000000000",
          "engine_adapter_path": "scripts/macos_vision_ocr.swift",
          "engine_adapter_sha256": "0000000000000000000000000000000000000000000000000000000000000000",
          "source_sha256": "0000000000000000000000000000000000000000000000000000000000000000",
          "language_set": ["zh-Hans", "en-US"],
          "uses_language_correction": false,
          "observation_count": 0
        }
      ],
      "region_ocr_passes": [
        {
          "pass_id": "SRC_001_REGION_BRAND_MARK_REGION_01",
          "region_id": "REGION_BRAND_MARK",
          "surface_id": "SURFACE_FRONT",
          "physical_layer_id": "front_print_outer",
          "visibility_mode": "direct",
          "region_purpose": "graphic",
          "source_id": "SRC_001",
          "source_file_sha256": "0000000000000000000000000000000000000000000000000000000000000000",
          "engine_id": "macos_vision",
          "engine_version": "replace_with_observed_version",
          "language_set": ["zh-Hans", "en-US"],
          "uses_language_correction": false,
          "observation_count": 0,
          "zero_detection_review_status": "not_applicable_non_text_region",
          "region_spec_path": "01_ocr/brand_mark_region_spec.json",
          "region_spec_sha256": "0000000000000000000000000000000000000000000000000000000000000000",
          "coordinate_origin": "top_left",
          "bounding_box_normalized": {"x": 0.2, "y": 0.2, "width": 0.2, "height": 0.1},
          "crop_method": "axis_aligned_normalized_bbox_v1",
          "rectifier_script_sha256": "0000000000000000000000000000000000000000000000000000000000000000",
          "crop_receipt_path": "01_ocr/rectified_regions/SRC_001/REGION_BRAND_MARK.crop_receipt.json",
          "crop_receipt_sha256": "0000000000000000000000000000000000000000000000000000000000000000",
          "crop_receipt_semantic_sha256": "0000000000000000000000000000000000000000000000000000000000000000",
          "rectified_crop_path": "01_ocr/rectified_regions/SRC_001/REGION_BRAND_MARK.png",
          "rectified_crop_sha256": "0000000000000000000000000000000000000000000000000000000000000000"
        }
      ],
      "text_observations": [],
      "code_observations": [],
      "ocr_review_status": "pending",
      "zero_detection_review_status": null
    }
  ],
  "preflight_status": "observations_ready",
  "ledger_semantic_sha256": "0000000000000000000000000000000000000000000000000000000000000000"
}
